text,speaker,season,episode,scene,utterance
"[Scene: The Wedding Hall, Monica and Chandler have just said ""I do,"" and the photographer is taking the required pictures. First of Monica, Chandler, Ross and Joey.]",Scene Directions,8,1,1,1
Great. Great! Just give me a sec to change film.,Photographer,8,1,1,2
Okay.,Monica Geller,8,1,1,3
"Okay, I know I'm not supposed to know, but I do. And I'm so excited for you!",Ross Geller,8,1,1,4
What? What's going on?,Joey Tribbiani,8,1,1,5
Monica's pregnant!,Ross Geller,8,1,1,6
Oh my God! Is that why you guys had to get married?!,Joey Tribbiani,8,1,1,7
Guys! I'm not pregnant.,Monica Geller,8,1,1,8
Ah. Slow swimmers?,Joey Tribbiani,8,1,1,9
What?! What do you mean? You-you-you're not pregnant?,Ross Geller,8,1,1,10
You didn't tell anybody I was did you?!,Monica Geller,8,1,1,11
No! I'll be right back.,Ross Geller,8,1,1,12
Now why don't we get a shot of just Monica and the bloody soldier.,Photographer,8,1,1,13
"Oh, about that. Joey, you have to change before the party.",Monica Geller,8,1,1,14
I can't! I-I don't have any other clothes here.,Joey Tribbiani,8,1,1,15
Find some! Please! Anything that doesn't say I-I died tragically in France.,Monica Geller,8,1,1,16
Well then why don't we see the bride and the groom and the bridemaids.,Photographer,8,1,1,17
"Okay. Hey Mon, why did you tell the guys you weren't pregnant?",Phoebe Buffay,8,1,1,18
Because I'm not.,Monica Geller,8,1,1,19
"We found your test in the trash, if you're not pregnant--It's because I am.",Phoebe Buffay,8,1,1,20
"(Flash, the photographer takes a picture of Monica and Chandler's stunned faces.)",Scene Directions,8,1,1,21
What?! What are you talking about?,Chandler Bing,8,1,1,22
What are you talking about?,Monica Geller,8,1,1,23
"Yes, I...I am with child. And I didn't want to say anything because it's your day; I didn't want to steal your thunder.",Phoebe Buffay,8,1,1,24
Wait a minute! So you told people I was pregnant?! Does this look like a conversation that I want to remember?!,Monica Geller,8,1,1,25
Who's the father?,Chandler Bing,8,1,1,26
Yeah!,Monica Geller,8,1,1,27
I can't say.,Phoebe Buffay,8,1,1,28
Why?!,Monica Geller,8,1,1,29
Why not?,Chandler Bing,8,1,1,30
I can't say because he's famous.,Phoebe Buffay,8,1,1,31
"Oh my God, who is it?!",Rachel Green,8,1,1,32
"Phoebe, come on, you have to tell us.",Monica Geller,8,1,1,33
"Okay, okay. It's James Brolin. James Brolin is the father of my baby.",Phoebe Buffay,8,1,1,34
As in Barbara Streisand's husband James Brolin?,Chandler Bing,8,1,1,35
What?! Well he never said that to me!,Phoebe Buffay,8,1,1,36
"[Scene: The Wedding Hall, continued from earlier.]",Scene Directions,8,1,2,1
Why don't we have Monica step away and we'll get Chandler and the bridemaids.,Photographer,8,1,2,2
How about just the bridemaids?,Phoebe Buffay,8,1,2,3
Y'know I am the groom right? I was told it was kinda big deal.,Chandler Bing,8,1,2,4
It is.,Phoebe Buffay,8,1,2,5
For you.,Rachel Green,8,1,2,6
Oh my God!,Phoebe Buffay,8,1,2,7
"Oh, thank you for doing that. I just can't deal with this just quite yet.",Rachel Green,8,1,2,8
So instead you told me Monica was pregnant.,Phoebe Buffay,8,1,2,9
"You said that she was, I just didn't disagree with you.",Rachel Green,8,1,2,10
Sneaky.,Phoebe Buffay,8,1,2,11
Oh yeah.,Rachel Green,8,1,2,12
Smile ladies.,Photographer,8,1,2,13
Oh! Oh by the way?,Rachel Green,8,1,2,14
Uh-hmm.,Phoebe Buffay,8,1,2,15
James Brolin?,Rachel Green,8,1,2,16
"Oh, I know. I could only think of two names, him and Ed Begley Jr. and then I remembered he's gay.",Phoebe Buffay,8,1,2,17
Ed Begley Jr. is not gay.,Rachel Green,8,1,2,18
Really?!,Phoebe Buffay,8,1,2,19
"[Scene: The Reception Hall, the party is in full swing.]",Scene Directions,8,1,3,1
"Thank you very much! Ladies and gentlemen, it gives me great pleasure to introduce to you for the very first time, Mr. and Mrs. Chandler Bing!",Bandleader,8,1,3,2
(They enter.),Scene Directions,8,1,3,3
Before we go out there I've got a present for ya.,Chandler Bing,8,1,3,4
"Honey, I'm going to put my hand in your pocket!",Monica Geller,8,1,3,5
No?,Chandler Bing,8,1,3,6
No.,Monica Geller,8,1,3,7
I've been taking dancing lessons.,Chandler Bing,8,1,3,8
What?!,Monica Geller,8,1,3,9
"Yeah, the last six weeks. I wanted this to be a moment you will never forget.",Chandler Bing,8,1,3,10
Oh that is so sweet!,Monica Geller,8,1,3,11
So? Would you care to join me in our first dance as husband and wife?,Chandler Bing,8,1,3,12
Yes.,Monica Geller,8,1,3,13
(They walk onto the dance floor and Chandler slips and almost falls.),Scene Directions,8,1,3,14
What's the matter?,Monica Geller,8,1,3,15
"I don't know, it's these new shoes, they're all slippery.",Chandler Bing,8,1,3,16
"Well, are you going to be able to do this?",Monica Geller,8,1,3,17
Not well.,Chandler Bing,8,1,3,18
(They start dancing and Chandler starts slipping around.),Scene Directions,8,1,3,19
"Well, the good news is, I don't think anyone's looking at us.",Monica Geller,8,1,3,20
[Cut to Phoebe and Rachel at their table.],Scene Directions,8,1,3,21
"So, are you ready to talk about it?",Phoebe Buffay,8,1,3,22
No.,Rachel Green,8,1,3,23
(Pause),Scene Directions,8,1,3,24
Now?,Phoebe Buffay,8,1,3,25
No!,Rachel Green,8,1,3,26
"Okay, we'll talk about something else then.",Phoebe Buffay,8,1,3,27
Thank you.,Rachel Green,8,1,3,28
Who's the father?!,Phoebe Buffay,8,1,3,29
"Ugh! Look honey y'know what? I haven't told him yet, so until I do I don't think I should tell anybody else.",Rachel Green,8,1,3,30
Yeah. That's fine. That's fair. Is it Tag?,Phoebe Buffay,8,1,3,31
Phoebe!!,Rachel Green,8,1,3,32
"Okay, I'm sorry. I'll stop.",Phoebe Buffay,8,1,3,33
Okay.,Rachel Green,8,1,3,34
"Is it Ross? It's Ross isn't it-Oh my God, it's Joey!",Phoebe Buffay,8,1,3,35
"Honey, stop it! I am not going to tell you until I tell him.",Rachel Green,8,1,3,36
Ah-hah! At least we know it's a him.,Phoebe Buffay,8,1,3,37
[Cut to Joey entering wearing a preppy tennis outfit.],Scene Directions,8,1,3,38
Oh sweet Lord.,Monica Geller,8,1,3,39
"I'm sorry! Okay? I went down to the gift shop and it's either this or a bathrobe! Look, what's more important, the way I'm dressed or me being with you on your special day?",Joey Tribbiani,8,1,3,40
"Honey, I'm not even going to pretend I was listening. Hey! Hey!",Monica Geller,8,1,3,41
"[Cut to the hallway outside the room, Ross is going to see which table he's at and sees a beautiful woman doing the same thing.]",Scene Directions,8,1,3,42
"Hi. I'm uh, I'm Ross. I don't, I don't believe we've met. I'm Monica's older brother.",Ross Geller,8,1,3,43
"Oh hi, I'm, I'm Mona from her restaurant.",Woman,8,1,3,44
"Oh! Hello uh, Mona from her restaurant. Mona, wow what a, what a beautiful name.",Ross Geller,8,1,3,45
You think so? I've always kinda hated it.,Mona,8,1,3,46
"Aw come on, Mona Lisa?",Ross Geller,8,1,3,47
Uh-huh.,Mona,8,1,3,48
"Mona umm...Clickclocken. The famous botanist? Huh? Oh no she's uh-well she's dead now. No, supposedly she was once quite the hottie of the plant world.",Ross Geller,8,1,3,49
Really?! Well see? I never knew about her.,Mona,8,1,3,50
"Linda Clickclocken. So what uh, what-what table are you at? Oh, uh me too.",Ross Geller,8,1,3,51
Oh good. Now there'll be someone there who likes my name.,Mona,8,1,3,52
"Yes there will. Oh guess what, Molly Gilbert you've just been bumped up to table one. And if it's all right with you I'm gonna take your place at table six-Martin Clickclocken.",Ross Geller,8,1,3,53
[Cut back inside to Joey giving a beautiful woman a tennis lesson by standing behind her.],Scene Directions,8,1,3,54
"That's better, now just bend your arms a little more. There you go. Okay, look straight ahead. Now this time I want you to really put your ass into it.",Joey Tribbiani,8,1,3,55
"[Cut to Chandler sitting down near Joey as his mom walks over. His birth mother, not the mother who recently visited one of those clinics in Sweden.]",Scene Directions,8,1,3,56
"Chandler darling! Look, my date has finally arrived. I'd like you to meet Dennis Phillips.",Nora Tyler Bing,8,1,3,57
Congratulations.,Dennis Phillips,8,1,3,58
Thank you.,Chandler Bing,8,1,3,59
Dennis is a dear old friend and a fantastic lover.,Nora Tyler Bing,8,1,3,60
Bravo Dennis thanks for pleasing my mother so.,Chandler Bing,8,1,3,61
"Oh, I'm so sorry I missed the ceremony, I was stuck at auditions.",Dennis Phillips,8,1,3,62
"Oh yes, Dennis is directing a new Broadway show.",Nora Tyler Bing,8,1,3,63
"I don't believe we've met, Joey Tribbiani.",Joey Tribbiani,8,1,3,64
Dennis Phillips,Dennis Phillips,8,1,3,65
"Wow, I've admired your work for years. You-you've done some really amazing stuff.",Joey Tribbiani,8,1,3,66
"Oh, thank you. Well if you'll excuse me, I'm gonna go get myself a drink. Be back in a moment.",Dennis Phillips,8,1,3,67
Wow Dennis Phillips! That's great! How did you guys meet?,Joey Tribbiani,8,1,3,68
"Well, it's a funny story.",Nora Tyler Bing,8,1,3,69
Funny: Ha-Ha Or Funny,Chandler Bing,8,1,3,70
[Time lapse. The band is finishing another song.],Scene Directions,8,1,3,71
"Thank you, thank you very much. If everyone will please take your seats, dinner will be served.",Bandleader,8,1,3,72
(Ross starts looking for table six and finds out that it's the kid's table. He sees Mona sitting at another table.),Scene Directions,8,1,3,73
"Hey! Uh, I thought, I thought you were at table six.",Ross Geller,8,1,3,74
"No, nine.",Mona,8,1,3,75
"Oh see, before you uh, when you showed it to me you-you held it that way which uh, which was misleading. Well I'm... Hello.",Ross Geller,8,1,3,76
"[Cut to the hallway, Chandler is putting tape on the bottom of his shoes.]",Scene Directions,8,1,3,77
"Chandler. Will you see if your mom can give my resume to Dennis Phillips? 'Cause if I can get in a Broadway show then I would've done it all, film, television, and theater. The only think left would be radio, and that's just for ugly people.",Joey Tribbiani,8,1,3,78
What size shoes do you wear?,Chandler Bing,8,1,3,79
"Uh, eleven, eleven and a half.",Joey Tribbiani,8,1,3,80
"Great, because my shoes are giving me a little problem on the dance floor, can I borrow the boots from your costume?",Chandler Bing,8,1,3,81
"Uh, I don't even really know where I left those. Sorry.",Joey Tribbiani,8,1,3,82
Those aren't eleven and a half.,Chandler Bing,8,1,3,83
"Okay fine! I'm a seven! All right, I have surprisingly small feet. But the rest of me is good, I'll show ya!",Joey Tribbiani,8,1,3,84
[Cut to Monica and Rachel at their table.],Scene Directions,8,1,3,85
Can you believe Phoebe got pregnant?!,Monica Geller,8,1,3,86
Oh y'know what honey? Let's not talk about that right now?,Rachel Green,8,1,3,87
This is so huge.,Monica Geller,8,1,3,88
"Sure, but come on, as big as your wedding?",Rachel Green,8,1,3,89
Of course not nothing is. Between me and you...,Monica Geller,8,1,3,90
Yeah.,Rachel Green,8,1,3,91
...in this day and age how dumb do you have to be to get pregnant?,Monica Geller,8,1,3,92
"Hey! Y'know, sometimes you can do everything right, everyone can wear everything they're supposed to wear, and one of those little guys just gets through!",Rachel Green,8,1,3,93
How?,Monica Geller,8,1,3,94
I don't know! Maybe they have tools.,Rachel Green,8,1,3,95
"Well I-I talked to and uh, she's definitely going to have this baby. Y'know, she said she was gonna raise it on her own.",Monica Geller,8,1,3,96
"Well, maybe that's, maybe that's really brave.",Rachel Green,8,1,3,97
Maybe. I just hope she realizes how hard it's gonna be.,Monica Geller,8,1,3,98
Maybe she hasn't really thought it through that well.,Rachel Green,8,1,3,99
"Well, there's a lot to think about. I mean, how is she, how is she going to handle this financially? How is she going to juggle work? Does she realize she's not going to have a date again for the next eighteen years?",Monica Geller,8,1,3,100
I don't know.,Rachel Green,8,1,3,101
Are you okay?,Monica Geller,8,1,3,102
Uh-hmm. I'm just thinking about Phoebe; poor knocked up Phoebe.,Rachel Green,8,1,3,103
Champagne?,Waiter,8,1,3,104
Oh yes! Thank you very much! Oh that's-that's actually how the French drink it.,Rachel Green,8,1,3,105
(Monica gasps.),Scene Directions,8,1,3,106
"[Scene: continued from earlier, only now Phoebe joins them.]",Scene Directions,8,1,4,1
"Well, I just got off the phone with my lover, James Brolin...",Phoebe Buffay,8,1,4,2
Oh really?!,Monica Geller,8,1,4,3
"Yes, and apparently he is married to some singer, but he said he would leave her for me. And I said, ""James, James Brolin, are you sure?"" James Brolin said...",Phoebe Buffay,8,1,4,4
Rachel's really the one who's pregnant.,Monica Geller,8,1,4,5
What?! Why bother?,Phoebe Buffay,8,1,4,6
How do you feel?,Monica Geller,8,1,4,7
I don't know. I don't know how I feel. This is all happening so fast. I have to make all these decisions that I don't want to make. Somebody just take this away from me!!,Rachel Green,8,1,4,8
Calm down. Maybe you're not pregnant.,Phoebe Buffay,8,1,4,9
What?!,Rachel Green,8,1,4,10
"When I got pregnant with the triplets, I took that test like three times just to make sure.",Phoebe Buffay,8,1,4,11
Yes! Maybe it's a false positive. Are you sure you peed on the stick right?,Monica Geller,8,1,4,12
How many ways are there to do that?,Rachel Green,8,1,4,13
"I'm-I'm just saying, don't freak out until you're a hundred percent sure.",Phoebe Buffay,8,1,4,14
"All right, I'll-I'll take it again when I get home.",Rachel Green,8,1,4,15
"You-you gotta take it now. Come on, do it as a present to me.",Monica Geller,8,1,4,16
Okay. Thank you.,Rachel Green,8,1,4,17
Okay.,Monica Geller,8,1,4,18
I'll run out and get you one.,Phoebe Buffay,8,1,4,19
"Oh, you guys are so great.",Rachel Green,8,1,4,20
"Oh, wait a minute! Who's is the father?!",Monica Geller,8,1,4,21
"Oh no, she won't tell us.",Phoebe Buffay,8,1,4,22
"Oh, come on it's my wedding! That can be my present.",Monica Geller,8,1,4,23
"Wh-Hey, I just gave you peeing on a stick.",Rachel Green,8,1,4,24
See? This is why you register.,Phoebe Buffay,8,1,4,25
[Cut to Ross at the kiddie table. He reaches for something and a fart noise emanates which causes the kids to laugh.],Scene Directions,8,1,4,26
"It was the chair again! Okay? I'm not doing it! It what-look, I don't-y'know what-eh-eh... Hi.",Ross Geller,8,1,4,27
Hi!,Mona,8,1,4,28
"Umm, would you like to dance?",Ross Geller,8,1,4,29
Sure.,Mona,8,1,4,30
Yeah?,Ross Geller,8,1,4,31
Yeah.,Mona,8,1,4,32
Oh great!,Ross Geller,8,1,4,33
Dr. Geller?,Little Girl,8,1,4,34
"I wasn't farting! Uh, a little game from our table. Yes?",Ross Geller,8,1,4,35
"Dr. Geller, will you dance with me?",Little Girl,8,1,4,36
"Oh umm, well uh, maybe-maybe later. Right now, I'm about to dance with this lady.",Ross Geller,8,1,4,37
Okay.,Little Girl,8,1,4,38
Ohhhh!,Mona,8,1,4,39
"Uh, unless! Unless, uh this lady wouldn't mind letting you go first.",Ross Geller,8,1,4,40
I'd be happy to. You are very sweet.,Mona,8,1,4,41
"Yes I-I am. In fact umm hey, why don't we try it my special way? You can dance on my feet.",Ross Geller,8,1,4,42
Sure!,Little Girl,8,1,4,43
Yeah? Hop on. Is the pretty lady looking?,Ross Geller,8,1,4,44
Uh-huh.,Little Girl,8,1,4,45
Keep dancing.,Ross Geller,8,1,4,46
[Cut to Chandler in the hallway practicing dancing and is doing it very well.],Scene Directions,8,1,4,47
And the world will never know.,Chandler Bing,8,1,4,48
Hey! Did you talk to Dennis about me yet?,Joey Tribbiani,8,1,4,49
"Yes, I told him how talented you were. I told him all about Days Of Our Lives.",Chandler Bing,8,1,4,50
No-no! No! No! You don't tell a Broadway guy that! Now he just thinks I'm a soap actor.,Joey Tribbiani,8,1,4,51
But you're not just a soap actor. You are a soap actor with freakishly tiny feet.,Chandler Bing,8,1,4,52
Hey!,Joey Tribbiani,8,1,4,53
[Joey walks back inside just as Ross's dance is finishing.],Scene Directions,8,1,4,54
Thank you.,Little Girl,8,1,4,55
"No-no, thank you Miranda.",Ross Geller,8,1,4,56
Melinda!,Little Girl,8,1,4,57
All right.,Ross Geller,8,1,4,58
How cute was that?,Mona,8,1,4,59
"Oh-oh, were you, were you watching?",Ross Geller,8,1,4,60
(Another little girl walks over to him.),Scene Directions,8,1,4,61
Can I go next?,Second Girl,8,1,4,62
What? Of course you can! Hop on!,Ross Geller,8,1,4,63
"Okay, but I get to hop on after her.",Mona,8,1,4,64
I am so gonna score.,Ross Geller,8,1,4,65
What?,Second Girl,8,1,4,66
I like your bow.,Ross Geller,8,1,4,67
"[Behind them, Joey goes up to the bandleader and interrupts the song.]",Scene Directions,8,1,4,68
"I'd like to propose a toast. To Monica and Chandler, the greatest couple in the world. And my best friends. Now, my when I first found out they were getting married I was, I was a little angry. I was like, ""Why God? Why? How can you take them away from me?!"" But then I thought back over all our memories together, some happy memories. And-and there was some sad memories. I'm sorry. And-and some scared memories-Whoa! Eh? And then, and then I realized I'll always be their friend, their friend who can speak in many dialects and has training in stage combat and is willing to do partial nudity. Oh! To the happy couple!",Joey Tribbiani,8,1,4,69
"[Time Lapse, the interrupted song is finishing.]",Scene Directions,8,1,4,70
Thank you.,Bandleader,8,1,4,71
That was very nice Ashley.,Ross Geller,8,1,4,72
Can we do it again?,Ashley,8,1,4,73
No-no.,Ross Geller,8,1,4,74
"So, is it my turn now?",Mona,8,1,4,75
(A large little fat girl walks over.),Scene Directions,8,1,4,76
I'm next!,Fat Girl,8,1,4,77
Oh!,Ross Geller,8,1,4,78
"Uh, that's okay. You can dance with her first.",Mona,8,1,4,79
"Oh, you-you sure? Okay. Okay. So what's uh, what's your name.",Ross Geller,8,1,4,80
Gert!,Fat Girl,8,1,4,81
"That's, that's pretty. Whoa! Whoa! Whoa! What are you doing there Gert?",Ross Geller,8,1,4,82
Dancing on your feet! Like the other girls did it.,Gert,8,1,4,83
Okay. Hop on Gert.,Ross Geller,8,1,4,84
Why aren't you moving your feet?,Gert,8,1,4,85
I'm trying.,Ross Geller,8,1,4,86
Faster! You're not going fast enough!,Gert,8,1,4,87
Maybe I should stand on your feet!,Ross Geller,8,1,4,88
[Cut to Joey going over to talk to Dennis Phillips.],Scene Directions,8,1,4,89
"So did you uh, happen to catch my toast up there?",Joey Tribbiani,8,1,4,90
"Oh my God, that was for my benefit?",Dennis Phillips,8,1,4,91
"Well, I'd like to think there was something for everyone. Look, I know you're casting for this new show...",Joey Tribbiani,8,1,4,92
"Look umm Joey, I-I don't think you're quite right for this project.",Dennis Phillips,8,1,4,93
"Oh, see that's where you're wrong. Whatever it is I can do it. And if didn't see it up there, just-just try me.",Joey Tribbiani,8,1,4,94
It's an all Chinese cast. Can you be Chinese?,Dennis Phillips,8,1,4,95
"Well I'm not proud of this, but...",Joey Tribbiani,8,1,4,96
Oh my God! No-no-no! Please! Please! Don't-don't-don't!,Dennis Phillips,8,1,4,97
[Cut to Monica walking up to Chandler.],Scene Directions,8,1,4,98
"Hey, are you ready to get back on the dance floor?",Monica Geller,8,1,4,99
Did it turn into sand?,Chandler Bing,8,1,4,100
"Ohh come on, I love this song! Come on, you'll be fine.",Monica Geller,8,1,4,101
"No. No, I won't. Do you know why I took all those lessons? See, for the first time I didn't want you to be embarrassed to be seen on the dance floor with some clumsy idiot.",Chandler Bing,8,1,4,102
"Oh sweetie, you can never embarrass me. Okay, you can easily embarrass me. But come on, it doesn't matter. All right? I married you! So I want to dance on my wedding night with my husband. Come on. Just try not to move your feet at all. There you go.",Monica Geller,8,1,4,103
(Mr. Geller dances over.),Scene Directions,8,1,4,104
"Chandler, I'm gonna have you arrested.",Jack Geller,8,1,4,105
Why?,Chandler Bing,8,1,4,106
You stole my moves.,Jack Geller,8,1,4,107
"[Scene: The Women's Restroom, Rachel and Phoebe are waiting for the outcome of Rachel's second test.]",Scene Directions,8,1,5,1
How much longer?,Rachel Green,8,1,5,2
30 seconds.,Phoebe Buffay,8,1,5,3
"30 seconds, okay.",Rachel Green,8,1,5,4
"Did I miss it? Rachel, I-I want you to know that, if it's positive, we're gonna...",Monica Geller,8,1,5,5
Oh I know. I know.,Rachel Green,8,1,5,6
It's time.,Phoebe Buffay,8,1,5,7
(Another woman starts to enter.),Scene Directions,8,1,5,8
No!!,The Girls,8,1,5,9
Go ahead Rach.,Monica Geller,8,1,5,10
(She goes over to look.),Scene Directions,8,1,5,11
"Oh wait! Y'know what? I can't, I can't look at it. I can't. Somebody else tell me, somebody tell me.",Rachel Green,8,1,5,12
Okay.,Phoebe Buffay,8,1,5,13
Okay.,Rachel Green,8,1,5,14
"Umm, it's negative.",Phoebe Buffay,8,1,5,15
What?,Rachel Green,8,1,5,16
It's negative.,Phoebe Buffay,8,1,5,17
"Oh. Oh. Well there you go. Whew! That is-that's great-that is really great-great news. Y'know 'cause the whole not being ready and kinda the financial aspects, all that. Whew. Wow, this is so just the way it was supposed to be. God.",Rachel Green,8,1,5,18
"Well... Well, great.",Monica Geller,8,1,5,19
Here.,Phoebe Buffay,8,1,5,20
Thanks. God this is so stupid! How could I be upset over something I never had? It's negative?,Rachel Green,8,1,5,21
"No, it's positive.",Phoebe Buffay,8,1,5,22
What?!,Rachel Green,8,1,5,23
"It's-it's not negative, it's positive.",Phoebe Buffay,8,1,5,24
Are you sure?,Rachel Green,8,1,5,25
"Well yeah, I lied before.",Phoebe Buffay,8,1,5,26
Oh!,Rachel Green,8,1,5,27
Oh God...,Monica Geller,8,1,5,28
Now you know how you really feel about it.,Phoebe Buffay,8,1,5,29
"Oh-oh, that's a risky little game!",Rachel Green,8,1,5,30
Are you really gonna do this?,Monica Geller,8,1,5,31
Yeah. I'm gonna have a baby. I'm gonna have a baby. I'm gonna have a baby!,Rachel Green,8,1,5,32
With who?,Phoebe Buffay,8,1,5,33
"Ah, it's still not the time.",Rachel Green,8,1,5,34
Dedicated to the People of New York City,Scene Directions,8,1,5,35
"[Scene: The Reception, Joey is helping Ross walk after Gert got through with him and Mona is looking on concerned.]",Scene Directions,8,1,6,1
I just didn't see the fast song coming.,Ross Geller,8,1,6,2
"Shh. Shh. Don't try to talk, we'll get you up to your room, we'll soak your feet, you'll be okay.",Joey Tribbiani,8,1,6,3
"Oh, thank you.",Ross Geller,8,1,6,4
That is so sweet!,Mona,8,1,6,5
Yeah.,Joey Tribbiani,8,1,6,6
"No, I mean it. There are so few genuinely nice guys out there.",Mona,8,1,6,7
"Tell me about it, I feel like I'm holding down the fort all by myself.",Joey Tribbiani,8,1,6,8
It's Joey right?,Mona,8,1,6,9
Yeah.,Joey Tribbiani,8,1,6,10
Wait a minute! No! I'm the nice one! I'm the one who danced with the kids all night! How...How small are your feet?!,Ross Geller,8,1,6,11
